Semester,Last Updated,Review Text,Upvotes,Downvotes,Review Average,Instr Rating,Enoyability,Recommend,Difficulty,Hours Per Week
Fall 2012,12/20/12,"Elzinga chooses to lecture to the lowest common denominator but gladly takes questions about tangent topics after class (and can answer them with great insight). What many people who review this course don't seem to realize is that by taking this class, the most significant thing you gain access to is Elzinga's vast supply of human capital. That's what can make this class so worthwhile and life changing - you just have to go to office hours for it, which I would highly recommend. General Course Information: 1) graded out of 400 or 200 points a) the 400 point option is two 80 point tests, 20 points from discussion quizzes, 20 points from clicker questions in lecture, and 200 points for the final b) the 200 point option is known as the ""Dutch Knockout,"" in it your final exam grade is doubled and taken as your entire course grade. 2) my TA was not hard to understand in the slightest. I would say the TAs aren't that necessary, but just something the school does for such a large class to keep student to faculty ratios low. I'm not sure if it is just people not doing as well as they expected and trying to blame it on someone or if some of them are actually bad. 3) Geng's test score average was always about 6 points higher than the class average, so either his sections were actually smarter, or he was an easier grader. 4) the final exam is not nearly as difficult as people seem to make it out to be. Basically consists of either very basic ideas/concepts/definitions questions (which you don't need to study for) and more difficult ""how well you can think about things you have learned throughout the course"" questions (which you truly cannot study for). Bottom-line: Kenneth ""The Man"" Elzinga is more than worth your time. Take this class.",0,0,5.00,5,5,5,1,1
Fall 2012,12/20/12,"Great class. The Dutch knockout technique he uses really saved my grade. Make sure you know the material inside out and READ THE TEST QUESTIONS CAREFULLY, Elzinga's very tricky.",0,0,4.00,4,4,4,3,4
Fall 2012,12/19/12,"This was the worst class I have taken at UVA.(Accounting was more exciting!)
TA was rude and couldn't speak English.
Apparently, quoting definitions verbatim from the textbook is wrong because we are supposed to ""use the definitions Elzinga created in lecture"" and ""[we] should not always trust what the textbook says.""
Tests are very poorly written, making it difficult to understand what the problem is asking.",0,0,1.00,1,1,1,1,1
Fall 2012,11/19/12,"The lectures are interesting, but it's very easy to become intimidated in a room of 500+ people.  This class is definitely not easy...tests are very tricky.  That being said, the class is definitely worthwhile, but probably not as ""life changing"" as some people talk it up to be.",0,0,4.00,4,4,4,5,5
Fall 2012,11/14/12,Elzinga's the man. His class is very tricky and challenging though. Definitely not an easy A,0,0,4.33,4,5,4,5,2
Fall 2012,11/12/12,"LOVE elzinga but DON'T GET BILL (WILLIAM) JOHNSON AS A TA.  He is incredibly unclear and always confuses the class with examples that don't make sense.  I walk in understanding the material, and walk out confused. Try to get the head TA instead!",0,0,4.33,4,4,5,3,1
Fall 2012,11/09/12,"Would not recommend Bill Johnson. Elzinga is great, but his class is hard!",0,0,4.00,4,4,4,4,0
Fall 2012,11/07/12,"Most difficult class of first year by far, but elzinga is a god. take the class and take it seriously",0,0,4.67,5,4,5,5,3
Fall 2012,10/31/12,"I liked the lectures and material, but there seemed to be a wide difference between what was emphasized and how those ideas were covered in the lectures and discussions versus the exams. ",0,0,4.00,4,4,4,4,2
Fall 2012,10/29/12,"Professor Elzinga is a historic teacher at the University, and is a great guy. Read the book and go over examples and this class should be easy unless you don't like large classes.",0,0,4.00,4,4,4,3,2
Fall 2012,9/20/12,awesome class with a world famous economist. It's a UVa must,0,0,4.33,4,4,5,3,2
Fall 2011,7/24/12,This class was very easy. Just make sure you go to class.,0,0,4.67,4,5,5,2,2
Fall 2011,7/17/12,Just one of those classes everyone takes at UVA. Great teacher -- you'll learn a lot and have a good shot at an A. Definitely recomended,0,0,5.00,5,5,5,3,5
Fall 2011,12/19/11,"Elzinga is a nice guy, but his lectures are not really helpful for preparing for tests. A lot of people show up just for the clicker points. Definitely read the textbook and do the study guide questions to prepare for tests. ",0,0,3.00,3,3,3,4,4
Fall 2011,12/18/11,"Elzinga was a pretty good professor despite having such a large class.  Final exam wasn't as hard as it's made out to be, but I didn't like how the grading of the course seemed so secretive until after the final.  Go to lectures, read Colander, and do the practice exams and it's not too hard to get a good grade in the class.  Iso is the head TA and is very knowledgeable, but it can be hard to understand him at times in discussion.",0,0,4.33,4,4,5,3,4
Fall 2011,12/18/11,"To be honest, I felt that the lectures were fairly dry and scripted and didn't end up going to many of them. I started going again to the last ones in the semester, and those were actually more enjoyable (and useful) as they covered general life lessons and hobbies (Elzinga's hobbies, but still, interesting). Read the book if it's written by Colander!!",0,0,3.00,3,2,4,3,0
Fall 2011,12/17/11,The Man!!,0,0,5.00,5,5,5,4,0
Fall 2011,12/16/11,"Professor Elzinga is such a sweet man, and I never skipped a lecture-- they were fast-paced, and he ended them in 50 minutes, even though the class was supposed to run 75. I had take micro before and not received credit (IB...) so I found it easy, but it may be hard to grasp if you have no economics knowledge. But definitely do go to his office hours if you take the class! He is sooo nice.",0,0,4.33,4,4,5,3,2
Fall 2011,12/15/11,"Read the Collander book.  Attend the lectures.  TA's don't speak English and aren't very helpful.  Final is brutal.  Overall awesome class, highly recommended!",0,0,5.00,5,5,5,3,4
Fall 2011,12/11/11,"I know everyone says this, but seriously, take this class. You'll learn a lot from a very good teacher. I highly recommend going to office hours to visit with Elzinga. Long wait sometimes, but it's worth it.",0,0,4.67,5,4,5,2,0
Fall 2011,12/01/11,Really gives you a grasp on what Econ is about. Elzinga is the best professor for it and should be the one to take. Material is definitely not easy so make sure to put in the effort and hours,0,0,4.00,4,4,4,4,0
Fall 2011,11/14/11,"I came into this class expecting a professor who could not only handle 500 students, but make it seem like you're the only one in the room. Unfortunately, I think I got a little over-hyped and when I realized that his lectures, though entertaining, are just another lecture, and for the most part, designed for large classes. I can't blame the guy, in fact, he's really cool, it's just not the life-altering experience everyone had promised me. For the most part, you get most of the material out of the Colander book. The discussion sections are virtually useless; I'd rather spend my time reading.",0,0,4.00,4,4,4,3,3
Fall 2011,11/11/11,Elzinga is awesome. Why are you even looking at this? Take the class,0,0,5.00,5,5,5,1,4
Fall 2011,11/10/11,"Great course, must take",0,0,4.00,4,4,4,2,6
Fall 2011,11/09/11,"Fantastic class, a must take.",0,0,5.00,5,5,5,2,1
Fall 2011,11/07/11,lectures are interesting and enjoyable. you can really tell he cares about his students and how economics is related to real world problems.,0,0,4.67,5,4,5,3,3
Fall 2011,11/01/11,"This class is hard. 2nd midterm was unnecessarily difficult for some reason even though in the past both midterms have been said to be easy. Elzinga is a cool dude, though.",0,0,3.67,4,4,3,4,0
Fall 2011,10/31/11,Great class. The lectures are very interesting. Take lots of notes. ,0,0,4.33,4,4,5,3,2
Fall 2011,10/31/11,Very Nice class,0,0,4.67,4,5,5,2,0
Fall 2011,10/28/11,"Great professor, worthwhile class to take. If you didn't take Econ in high school (and even still...) be prepared to work really hard and study for many days before the exam (to get at least a low B). The TA's are usually really hard to understand and not helpful at all. This class is also over 500 people so if you are better with working in smaller classes, then take in during Spring semester...although you'll be missing out on Elzinga, who's great.",0,0,4.00,5,3,4,4,4
Fall 2011,10/27/11,"Test is really fun and entertaining, although definitely not easy especially if you haven't taken economics before. If you did well in high school economics and have a fairly solid grasp of the subject you'll be fine for sure on the first test, the second test however you'll have to do your work and read the book because there are definitely notable differences between the book and what most coming into the course have learned before. A fun and entertaining class for sure, but  honestly can't say I learned much from going... really most people go to answer the clicker questions and get those easy points, although after the first exam if he sees a lot of it he'll start making the clicker questions towards the middle of the class so you can't just leave after the first 10 minutes. Decent class to take and of course another one of those precomm requirements, always in high demand so sign up early.",0,0,4.33,4,5,4,4,3
Fall 2011,10/26/11,"Zhou is such a great TA. She's so helpful and explains things in a meaningful way. Get in her discussion section if at all possible. With a good TA, one can really enjoy this class and learn a TON!",0,0,4.00,4,4,4,4,4
Fall 2011,10/21/11,"Elzinga is great, I definitely enjoy going to his lectures. Everyone should take this class. I just wish my TA was a better English speaker, because in discussion I spend more time trying to understand him than learning material. Make sure your TA is can speak English well and do your reading.",0,0,4.67,4,5,5,3,2
Fall 2011,9/24/11,Mr.Elzinga is amazing. Make sure you go to his office hour at least once. Cuz talking to him is great fun.,0,0,5.00,5,5,5,2,2
Fall 2011,8/22/11,the class was fine but the final was hard,0,0,3.33,4,3,3,2,2
Fall 2010,5/28/11,good class. all should take,0,0,4.67,5,4,5,3,2
Fall 2010,4/12/11,An awesome class.  Definitely worth waiting to take it with Elzinga. ,0,0,4.67,5,4,5,3,0
Fall 2010,4/09/11,"Great class overall. Just attend lectures, take down notes and review the chapters covered in the book before the exams. Class is extremely large however and minimal lecture slides are put up, so its up to you as to write down what you think is important (usually everything).",0,0,4.33,4,4,5,3,0
Fall 2010,3/28/11,Elzinga is great.  He handles lecture well and is very interesting.  Make sure to read and study because his test can be difficult.  Do not count on the dutch knockout.,0,0,4.67,4,5,5,4,2
Fall 2010,2/18/11,Great class! If you can get Zhou Zhang as your T.A.  She explains the material extremely well and is one of the few TAs that hold office hours the day of exam.  Extremely helpful!,0,0,5.00,5,5,5,3,2
Fall 2010,1/29/11,"Elzinga is a very good professor, but his class was much harder than I expected it to be",0,0,4.00,5,4,3,4,0
Fall 2010,1/20/11,"Professor Elzinga is awesome! His lectures are incredibly entertaining, and I probably would have gone to see them even if I weren't receiving credit for the course. As a warning-- the final was much harder than I expected.",0,0,5.00,5,5,5,4,5
Fall 2010,1/09/11,A must take class. Easy A- if you go to class and do the work. Hard final though,0,0,4.00,3,4,5,2,3
Fall 2010,12/29/10,"the final is hard, but it is curved. make sure you do the practice final exam.",0,0,2.67,4,3,1,4,0
Fall 2010,12/20/10,READ BEFORE LECTURES AND GO TO LECTURES,0,0,4.00,4,4,4,4,3
Fall 2010,12/16/10,"Lectures were interesting. Midterms and Final were difficult. Such a big class, easy to screw up. ",0,0,3.33,4,3,3,4,0
Fall 2010,12/02/10,"very helpful and through, helps a lot when reviewing for exams",0,0,3.67,4,3,4,3,3
Fall 2010,11/16/10,elzinga is a great professor but i think taking small classes would also be good.,0,0,3.67,4,4,3,4,0
Fall 2010,11/14/10,"Zach is a great TA and knows how to grade fairly! Both he and Elzinga are accessible, definitely recommend!",0,0,4.67,5,4,5,2,0
Fall 2010,11/14/10,good class,0,0,3.67,4,4,3,3,0
Fall 2010,11/11/10,"Awesome class, awesome professsor. Take this class with Elzinga. ",0,0,5.00,5,5,5,3,1
Fall 2010,11/11/10,"Elzinga is a resound teacher and is sincere. He's passionate about Economics and it translates into his lectures. Read the chapters and go to class and you should be fine. The final is challenging, but if you do well in the midterms, it balances out. ",0,0,4.00,4,4,4,3,4
Fall 2010,11/10/10,"Avoid Poyraz if you can as a TA, she is hard to understand...",0,0,3.67,4,3,4,3,1
Fall 2010,11/09/10,"Elzinga is a fine teacher. He is very hyped around campus. I don't know if he deserves it, while his personal accomplishments and knowledge are grand, this is him teaching the most basic economics course, which cannot be very demonstrative of those acheivements",0,0,3.00,4,2,3,2,2
Fall 2010,11/09/10,Solid teacher ,0,0,4.00,4,4,4,2,2
Fall 2010,11/08/10,"One of the easiest, and most interesting classes at UVa.  Also pretty fun.",0,0,4.33,5,4,4,2,2
Fall 2010,11/04/10,"Classic Class, one you have to take to get the full UVa experience",0,0,5.00,5,5,5,3,2
Fall 2010,10/29/10,elzinga's a great man. i have almost no interest in economics. i still don't after over 2 months of class with him but going to his lectures is still a pleasure.,0,1,4.33,5,4,4,3,2
Fall 2010,10/26/10,Elzinga is the man... take his class if you get the chance! Probably the most personable professor I've ever had.,0,0,4.67,5,4,5,2,3
Fall 2010,10/26/10,"Good class.  It made me realize that Econ's not really my thing.  It was interesting though, and Elzinga's definitely great.  My TA was kind of dumb in my opinion, like he couldn't spell really basic words, and sometimes he wouldn't know the answer to some of our questions, but he was nice and summed up the material well.",0,0,3.67,4,3,4,3,0
Fall 2010,9/28/10,"Elzinga is such a great teacher and such a nice man.  He never messes up in his lecture and is very approachable.  If you have the chance, even if you're not interested in econ, he makes it very enjoyable.",0,0,4.67,5,4,5,2,3
Fall 2010,9/16/10,"Elzinga is totally awesome.  This class is really easy overall, the material isn't difficult and is exceptionally elementary up until the first test.  It's almost embarrassing.  The clicker questions were a joke- I've yet to miss one, but hey, easy points, right?  But Elzinga is brilliant and amazing.  He is such an amusing individual- the class as a whole laughs frequently and genuinely, not forced for the sake of the teacher liking them.  Some people complained about how he starts and finishes a bit early for lecture and therefore ""doesn't use his time well"", but I've yet to see a need for the additional ten minutes or so that he usually cuts off.  He assigns very little work at all, your grades are almost entirely based on the tests, which I didn't find to be as bad as everyone else was describing.  Elzinga makes economics applicable, interesting, and fun.  Highly recommended, fantastic teacher.
Side ntoe: The mandatory discussion annoyed the hell out of me because I found it totally redundant and unnecessary, but Zach Moller is pretty good (can't really spell or write well but that's negligible), definitely not the worst I'd seen (I had to transfer out of Danila Panikov's session- he was horrid).",0,0,5.00,5,5,5,1,0
Fall 2009,7/12/10,I think this class is really hard if you have not had exposure to ECON before. I would recommend a smaller class it is easier to learn and you are allowed to ask questions.,0,0,2.00,1,3,2,4,6
Fall 2009,4/14/10,"Good Class, Dutch Knockout is the best.  Only problem is its like 500 people, so its easy to dose off and not care about the class.",0,0,4.00,4,3,5,2,0
Fall 2009,4/14/10,Elzinga is highly overrated. He wastes class time telling stories as opposed to working practice problems.,0,0,2.67,2,4,2,2,2
Fall 2009,4/13/10,"I had a horrible TA which made the class harder, but it was tough to begin with.  Do not take unless really interested in Econ/applying to the Comm school.",0,0,2.67,4,2,2,5,0
Fall 2009,4/12/10,Elzinga is awesome!!!  The class isn't very exciting  but is all need to know material.  Take it while you can.,0,0,4.33,5,3,5,3,2
Fall 2009,2/23/10,"A fairly easy class, but you still have to study for it. Elzinga is very dedicated to helping students, as for example he personally made sure I got back into the class after an error on SIS. Some TA's are much better than others, though, and this may significantly impact your grade because they vary on ability to explain the material and amount/difficulty of weekly quizzes.",0,0,4.33,4,4,5,2,0
Fall 2009,2/16/10,A must take class at UVA,0,0,5.00,5,5,5,2,0
Fall 2009,1/25/10,"A good class but the discussion section and homework problems were a big time waste.  Understand the basic concepts, and you will be golden.",0,0,4.00,5,3,4,3,2
Fall 2009,1/22/10,The class was harder than I expected but very doable if you read. Elzinga is a G.,0,0,4.00,4,4,4,3,0
Fall 2009,1/22/10,Elzinga is a wonderful professor.  Engaging lectures and tests aren't too difficult (they essentially come directly from his lectures),0,0,4.67,4,5,5,3,2
Fall 2009,1/21/10,Good class to take! ,0,0,4.33,4,4,5,3,0
Fall 2009,1/20/10,Great TA,0,0,4.00,5,3,4,4,4
Fall 2009,1/19/10,First half of the semester isn't too bad but the final is a killer. Elzinga is enthusiastic and approachable and makes lectures as enjoyable as possible.,0,0,3.67,4,3,4,4,2
Fall 2009,1/10/10,"I fell in love with Elzinga the moment I met him. His lectures are very interesting and its worth going to every class. The class is huge but its okay because you can easily find/create a study group. Make sure you get a good discussion time verses getting a good TA. I loved my TA but I had the WORST time ever(8am on friday, yuck). TOTALLY RECOMMEND!",0,0,3.67,1,5,5,2,2
Fall 2009,1/06/10,"Interesting class.  Elzinga can be a bit of a boring lecturer at times, but he is very nice and willing to help you if you don't understand something.  Although everyone says that the final is difficult, as long as you prepare enough you'll be fine.  I actually did better on the final than I did on the second test.",0,0,4.33,4,4,5,3,0
Fall 2009,12/24/09,"Elzinga's class is okay.  I can understand why first-years who come to U.Va and take his class during their first semester obsess over him, but from an upperclassman's perspective, he's really not a special lecturer.  I do have to give him props for making himself SO available for office hours / random discussions / dinners at his house.  He seems to care about his students a lot, but I just don't think he was that great as a professor.  Eggleston is the best T.A. far and away.  Easy grader, knows his stuff.  ",0,0,4.00,4,4,4,2,2
Fall 2009,12/20/09,"For an intro class, this one is pretty good. Elzinga makes the subject very interesting and lectures are usually well done. If you put in the effort, you can get a lot out of the class.
Make sure you understand the concepts thoroughly before taking the tests, and try to get through some practice questions/old tests if you can. Sherry was good, but don't miss any of her quizzes. ",0,0,4.33,4,4,5,3,3
Fall 2009,12/20/09,"great ta--really helpful, very accessible, fair grader. presents the material very well.",0,0,5.00,5,5,5,3,1
Fall 2009,12/19/09,"Really interesting class, Elzinga is usually pretty captivating and knows his stuff.  DO NOT GET RAHUL DUTTA as a discussion section leader.  Cannot think of a worse dicsussion leader.",0,0,5.00,5,5,5,3,1
Fall 2009,12/17/09,"Generally boring class with occasional interesting moments. Take it with someone else if you are more concerned about grades than entertainment, because the final is very hard.",0,0,2.67,4,2,2,4,5
Fall 2009,12/15/09,"good class, very informative",0,0,2.67,2,3,3,3,1
Fall 2009,12/14/09,"Overall, the class was kind of a disappointment!  I went into it thinking economics would be an interesting course, and it totally stunk.  I think Elzinga is a great person, but not the greatest of Lecturers",0,0,2.67,3,3,2,4,0
Fall 2009,12/13/09,Elzinga is a great economist and I really liked him as a person.  HOWEVER the tests were extremely difficult and I heard from others that the other professor for the other class isn't quite as interesting but the class is much easier.  Alex Smith is a really really good T.A. ,0,0,3.67,4,4,3,5,0
Fall 2009,12/12/09,"Elzinga is very interesting and this is a very easy class if you pay attention.  Lectures generally give only conceptual material but the midterms emphasize mathematical or graphical examples.  Therefore going to discussion is very useful, purchase the study guide too and it will save you a lot of reading!",0,0,4.67,4,5,5,1,1
Fall 2009,12/11/09,"Awful TA. Couldn't understand anything he said in discussion or anything he wrote on the board. Misgraded all my exams and was absolutely no help, whereas other TAs would give their students study guides and actual assistance.",0,0,4.00,4,4,4,4,1
Fall 2009,12/01/09,great but demanding,0,0,4.67,5,5,4,4,3
Fall 2009,11/19/09,"Great class and Elzinga is definitely the best professor to take it with! He makes himself very available to students, tests are fair and not too difficult. Overall, I'd definitely recommend it!",0,0,4.67,5,4,5,3,2
Fall 2009,11/17/09,Worthwhile class.,0,0,3.67,4,3,4,3,3
Fall 2009,11/17/09,"Same old same old, Elzinga is the king. He gave out his home phone number to 1000 students in case we needed help and he wasn't on grounds and the class is extremely simple if you skim the book and go to lecture. However, my T.A., Jie Liu, had such a profound misunderstanding of the english language that discussion was more entertaining than helpful... which made his quizzes impossible, because they, along with his lectures, were composed in what I can assume is the language that American infants utter.",0,0,4.00,4,4,4,2,3
Fall 2009,11/17/09,"Read the textbook, it really helps clarify lecture material! ",0,0,4.33,4,4,5,4,0
Fall 2009,11/17/09,"Elzinga is extremely over-rated. True, he is a good public speaker, but he doesn't even lecture for the whole class period (he starts late and ends early) and spends a good portion of the class reading emails people sent him. Elzinga is an intelligent person, but I feel like I don't learn much from his lectures. The tests are impossible to do well in unless you diligently ready the book. He doesn't hide his conservative political beliefs and sometimes comes off as a little arrogant. ",0,0,3.00,3,3,3,3,0
Fall 2009,11/16/09,"funny professor, good lecturer.  tests can be tricky though",0,0,4.33,4,4,5,4,4
Fall 2009,11/16/09,"overall, an okay class, doesnt live up to the hype for me",0,0,3.33,2,3,5,3,3
Fall 2009,11/15/09,"Rasit really cares about helping everyone, and sometimes can be hard to understand, but he realizes it and will explain something a different way to aid in fully understanding the material.",0,0,4.67,5,4,5,3,2
Fall 2009,11/12/09,"Great class. I didn't really know anything about economics before taking the class, so it was a great introduction to micro. Be sure to do the practice final to see what kind of multiple choice questions he may ask.",0,0,4.67,4,5,5,3,2
Fall 2009,11/12/09,"good class, elzinga is god",0,0,4.67,5,4,5,3,2
Fall 2009,11/11/09,"Final is hard, rest is easy",0,0,4.67,4,5,5,5,0
Fall 2009,11/11/09,"Exams are very hard, but only because they are written in unintentionally vague/misleading ways.",0,0,4.33,5,5,3,5,0
Fall 2009,11/07/09,great teacher,0,0,4.33,4,4,5,2,2
Fall 2009,11/04/09,He is that good. Don't let anyone convince you otherwise. He's why I'm an econ major.,0,0,5.00,5,5,5,3,1
Fall 2009,11/03/09,great proff,0,0,4.00,4,4,4,4,3
Fall 2009,10/30/09,"Class was fair until the Final, which proved to be much much harder than the tests. Be prepared for the final; as I was told that the final wasn't bad, didn't study enough, and then got crushed.",0,0,3.67,4,4,3,3,1
Fall 2009,10/27/09,"I absolutely loved this class! It made me want to major in economics! Professor Elzinga is interesting in lecture and really tries to get to know all of his students. Almost all of the reading is from the textbook, but it's actually pretty easy to read, especially for a textbook. But I would definitely recommend getting the study guide that goes along with it - it really helps with the tests.",0,0,5.00,5,5,5,4,2
Fall 2009,10/24/09,awesome class.,0,0,4.67,4,5,5,5,0
Fall 2009,10/23/09,"Awesome class, easy if you attend lecture and do readings.",0,0,5.00,5,5,5,2,3
Fall 2009,10/19/09,Elzinga's lectures are interesting.  The midterms are easy but many students get a false sense of confidence before the final which is tough.,0,0,4.33,4,4,5,3,6
Fall 2009,9/29/09,awesome clas.. very easy,0,0,5.00,5,5,5,2,0
Fall 2009,9/02/09,great prof!,0,0,4.67,4,5,5,5,2
Fall 2009,9/01/09,"Pretty good, Mirman is better",0,0,1.67,2,1,2,2,2
Fall 2009,8/27/09,AMAZING teacher!!! but don't count on the final.,0,0,4.67,4,5,5,2,0
Fall 2009,8/26/09,"This class is pretty interesting, but you have to make sure you read the book.  Don't try cramming--it doesn't work for this class.  My T.A. was horrible so I would get confused during discussions, so I would recommend going to office hours.",0,0,4.00,4,4,4,3,2
Fall 2009,8/25/09,"This was an awesome class. Take it if you want a good grade.  Fun material, so it is easy to pay attention.",0,0,4.67,4,5,5,5,2
Fall 2009,8/25/09,Good Class. Recommend it,0,0,4.00,4,4,4,3,2
