Semester,Last Updated,Review Text,Upvotes,Downvotes,Review Average,Instr Rating,Enoyability,Recommend,Difficulty,Hours Per Week
Fall 2020,12/10/20,"First off, I want to say that I like Professor Elzinga and truly feel that I learned a lot in this class. Unfortunately, that did not reflect in my grade. I think the one of most important things in this class is having a good TA who can help you interpret the dull lectures and textbook concepts. My TA wasn't the best...at all. The midterms are both short answer, however I found myself more confused by the questions at times than the actual class content. Some questions were real life situations that asked to be related to economics, but gave little to no context about which concept it was supposed to be applied to. It did not help that the answer key was very strict and left little room for interpretation. The final exam was multiple choice, and despite studying for hours, taking the practice final, and watching multiple YouTube videos to prepare, I still got a D...which turned into a C- thanks to the curve (thank god) because the questions were purposely worded in a confusing way. If you're trying to decide between courses, do not pick this one simply because Elzinga teaches it and he's a ""legend.""",0,0,2.33,4,2,1,4,3
Fall 2020,12/09/20,"Most overrated professor at UVA by far. For a supposed legend, Elzinga's class is not it, take Micro with someone else. His exams are really dumb in the sense that they grade for specific wording so if you don't say the answer exactly how they want it, you won't get credit. Elzinga mentions about 100 times how he taught some of our parents. His lectures are very useless as he'll maybe touch the very basic details about certain topics but will leave it up to you to learn the details. Reading the textbook is your best friend for exams and then making sure you pay attention to his econ minutes because he'll include random details on the exams.  #tCF2020",1,0,1.33,1,2,1,4,3
Fall 2019,5/13/20,"I was super scared to take Elzinga’s class because everyone complained about him, but I found his class to be enjoyable. If you read the textbook and pay attention in lecture, you can def get an A-. I had Kevin Miner as my TA, who was simply the best and made all the difference. Our group’s exam averages were always significantly higher than the rest of the class, and Kevin made sure to emphasize important information and convey it in a way you could understand. Also just a super chill dude. One thing I didn’t like was Elzinga constantly bringing the Bible into his lectures, but other than that I thought it was a great course. Made me want to further my studies in Econ. ",3,2,4.00,4,4,4,3,3
Fall 2019,4/29/20,"Great class I took it as a Second Year (Comm major) and did way better than in Macro during First Year (A- vs B) since I appreciated the topics/class more and knew how to prep for Econ exams.  Elzinga can be boring at times, but he is an amazing man and teacher and I personally always enjoyed lectures. For exams, read the book and make review sheets. Focus on knowing how graphs shift in certain situations and general concepts. My TA was Braedon Kehoe and he was a boss. Very helpful in discussion and pushed us in order to really be prepared for exams. Great class and you will learn a ton!! Oh, and the final is tough but the curve is awesome so you'll be fine. ",0,0,4.33,4,4,5,3,3
Fall 2019,4/10/20,One of the best classes you can take as a first year. Everyone should take this course and learn how the economy actually works. Elzinga is a beast,1,0,4.67,5,4,5,4,0
Fall 2018,7/10/19,"Mr. Elzinga is an incredibly knowledgeable professor! He delivers a pretty entertaining lecture, though I'd recommend sitting up front since it's a huge class. I wish I'd put more effort into this course, but I ended up with an A-.  The tests can be tricky, so make sure you memorize the definitions word for word, because the TAs have a strict rubric.  Make a few friends with different TAs too, since only some of them give out study guides / practice questions for the tests (which are SUPER helpful). ",2,1,3.67,4,3,4,3,7
Fall 2018,4/22/19,"Elzinga is an icon at UVA, and one of a select few professors that are worth taking no matter what your major is. Lectures are interesting enough, and if you read the chapters before class they are pretty straightforward. No work other than reading and reviewing for exams, and the occasional quiz in discussion. One of the best courses offered here at Mr. Jefferson's University.",2,4,4.33,5,3,5,3,1
Fall 2018,4/04/19,Easy course if you put in a good amount of time reading. Random fun facts mentioned in lectures might appear on the test. Professor goes off topic frequently but the material overall is fairly simple. ,0,0,3.00,3,2,4,2,2
Fall 2018,3/04/19,"Elzinga is a cute old man my problem is that he spends more time talking about the Econ minute than he does actually teaching the material. The head TA makes the tests and often they are worded to trick you then it is to test the information. EVEN IF ELZINGA SAYS SOMETHING WILL NOT BE ON THE TEST WRITE IT DOWN ANYWAYS, especially if it is about the name of people. I thought the information was really interesting but I would not recommend the course unless it is a prerequisite.",0,0,2.33,2,2,3,2,2
Fall 2018,2/06/19,"Do not take this class unless you love memorizing random facts and answering vague questions that TA's can even tell you what their asking.  If your a math person and prefer graph based and math based, logical, consistent formulas for solving problems, take Santagini. From what I heard, his class is much easier because you are tested on material that you have the tools and knowledge to solve.  In Elzinga's exams, he literally asked to recall a quote in a 200 page book... his exams are crazy. ",4,2,2.33,3,3,1,5,0
Fall 2018,2/01/19,"Professor Elzinga is an amazing teacher. Not only does he make the lectures super interesting with his unique humor and style, but he really takes the time to try to get to know his students, even with a class of around 900 students between two sections. Highly recommend going to office hours. As far as workload goes, there isn't any graded homework. The exams are a bit tough, but overall it's not a bad workload for a 3 credit course. Highly recommend this class, even if you're not super interested in economics.",1,1,5.00,5,5,5,3,1
Fall 2018,1/13/19,"Elzinga is a legend. He is an awesome guy, extremely wise, hilarious, knowledgable, and approachable. Lectures are amazing and I was legit excited for econ every Mon/Wed. If you read the textbook, take decent notes, and go to lectures, it's pretty easy to get a B+ or A-. A or better is much more difficult. Don't rely on the Dutch Knockout. The grading scale at the end makes it difficult to get the Dutch Knockout. I learned a completely new way of looking at the world. Don't graduate from UVA without being in Elzinga's class.",0,0,5.00,5,5,5,4,4
Fall 2018,1/01/19,"I found this course to be very manageable, and I felt like I learned a lot about the foundations of economics that can be very relevant to other courses and things in general. Elzinga was a very nice professor, but the lectures got to be a little boring, and I felt they weren't even super helpful, as the exams focused mainly on textbook material that Elzinga didn't necessarily focus on.  The TA sections were very helpful in breaking down the textbook, and the quizzes given helped in preparing for the exams. The two midterms are short answer, and if you go through the textbook you should be fine. The final was all multiple choice and I did not find it extremely challenging. There is a curve for the class and it is very, very helpful. I overall recommend this class and if you put in a good amount of work it's not hard to get an A, especially with the curve. ",1,1,3.33,3,3,4,3,3
Fall 2018,12/24/18,Overall the class ends up being fine. I had never taken an economics class before and I ended up coming out with a B- . His lectures are strange at times but I learned a lot from them. Definitely read the book if you aren't familiar with Economics because it defines things well. The two tests were relatively difficult with the final being harder than both but the curve at the end really saved me. As long as you go to class and study before the tests and finals it isn't hard to get an A or B in the class but a lot of people I know relied on dutch knockout and ended up screwing themselves grade wise. ,0,0,3.00,4,2,3,4,2
Fall 2018,12/21/18,"This class does not ask much of you other than going to the lectures and reading 1-2 chapters per week. You don't need to read the Mystery of the Invisible hand unless you really want to get the one question that was put on the final correct. Whatever you do, DO NOT TAKE DIVYA PANDEY as a TA. I took AP micro my senior year so I was comfortable in this class almost the entire time. I murdered the first exam, thought I was the goat and got a B- on the second exam, and then got a B - on the final, BUT the curve is so amazing that I ended up with an A- overall in the class. Soooo many people bomb Elzinga's tests that the minimum % for an A- this year was an 81.5. That's the best part of this course in my opinion. ",0,0,3.00,4,2,3,4,1
Fall 2018,12/20/18,"Elzinga definitely deserves his celebrity professor reputation; he's super friendly and knows a lot about econ. That said, his lectures were almost always dull. To make things even more problematic, the two midterms and final exam include questions about things brought up in lecture that weren't in the textbook, meaning you should try your hardest to pay attention and take solid notes. Elzinga grades on a curve so as long as you go to class, read the textbook, and do the problems the TAs send out, this class is an easy A or A-.",1,0,3.33,4,2,4,4,4
Fall 2018,12/20/18,"Elzinga is good, but in my opinion, generally a little overhyped. I felt a lot of his examples in economics in life were too abstract, usually dealing with art or other ""old people"" examples when he could have easily used any restaurant on the Corner to make his point.  His lectures are fairly boring, but can be interesting when he incorporates court cases he's worked on. Not too difficult with a pretty generous curve. Read Colander and don't rely on Dutch Knockout. '",1,0,4.00,4,3,5,2,2
Fall 2018,12/18/18,"Elzinga is really overrated in my opinion but the course itself was fine enough.  Having a good TA is VERY important if you want to do well in the class; I know for me personally, my TA definitely was a huge factor in why I was able to do well. If you attend lectures and discussions as well as keep up with the readings, you should be able to do just fine in the class. ",5,0,3.00,3,3,3,4,4
Fall 2018,12/17/18,"Take this class with Elzinga! I want to do politics/Batten/PPL so needed the pre-req and actually learned a ton. It's not easy though. Tests require intense studying and are very picky/specific. On one test, I gave the write definition except for one word and got the entire question wrong. It's also based on a curve (kind of) so it's hard to predict your score but it is compared to the average. For example, I got an A- for the class with 336/400 points for the semester so your grade will be higher than the percentage value.  Despite the specific and tricky tests, I did fine with no previous econ experience and decent studying for the exams. Read the textbook (it's like 1/4 of the class and some of it is never mentioned in lecture). But definitely take it. I've heard Santiguini (or the other guy who teaches it in the fall) is easier but it's more math-based...",1,1,3.67,4,3,4,4,1
Fall 2018,12/17/18,"I love everything about this course other than the test. All the contents Professor Elzinga taught were useful and he explained in a way that we could apply the lessons we learned to real-world situations. Besides that, Elzinga is also  such a sweet character and live up to his reputation on ground.
The tests and grades, on the other hand, are a totally different story. The two tests are all in short-answers which have very strict grading rules, detailed into specific wordings. If you explained the concept in a different format from the key, you are likely to be taken points off which,  in most of cases, are full points. The other thing is that this class is based on percentiles rather than scores, which means that you would not know your actual grades for the previous two test until final. The final is even more ""impossible"" with 75 MCs encompassing every details he mentioned in class, textbooks, and the required reading. This is definitely not an easy A class.",0,0,3.33,4,3,3,5,5
Fall 2018,12/16/18,"I took this course because it is a prereq for Batten and other degree programs I was interested in. I specifically took this course with Elzinga because he is so well known around Grounds and so many people told me I had to take it with him. Honestly, I don't see the big hype around him. He was a dry and boring lecturer and I often found his worldview very outdated (granted, he is rather old). The TAs are told to be extremely nit-picky when grading the two midterms which was extremely frustrating when you would get zero points on a 6 point question because you used a word in one of your definitions that was a synonym of the word they would've used. The final was unnecessarily tricky. Elzinga was honestly the worst professor I had this semester. He does not live up to the hype. My TA was good though.",3,2,2.00,2,2,2,4,4
Fall 2018,12/15/18,"Professor Elzinga is a legend at UVa. He is extremely knowledgeable in the economics field and has been teaching this course the same way for generations (literally-- the parents of some people in our lecture took it with him) . In my opinion, taking this class with Professor Elzinga is a rite of passage for any UVa student. Lectures are interesting and entertaining, but it is definitely necessary to do the supplemental textbook readings to succeed in the class. Also, pay close attention to the Econ minutes at the beginning of every lecture, because information from these shows up on the final exam. Overall, I enjoyed this course and am glad I took it with Elzinga. ",0,1,4.33,5,4,4,3,3
Fall 2018,12/14/18,"Elzinga is probably the only ""celebrity"" professor at UVA and he's a super nice guy. He tried to get to know the students that go to his office hours or ask him questions after class or email him. He's extremely knowledgeable in economics and is considered an expert in the field, though that has its drawbacks since he missed like 3 lectures this semester because he had to testify on various court cases. In lecture you complete clicker questions and he sometimes tells you that there will be some in the next class but not always, so I'd recommend going to every lecture until you get the 15 points for the clicker questions. That being said, he fills his exams with seemingly random concepts or facts that aren't mentioned in the textbook, so if you want to do well on the exams you should go to lecture and pay attention, though it's sometimes extremely hard due to the size of the class and his lectures are usually on the boring side. You also NEED to read the textbook since Elzinga brushes over actual foundational economics in lecture in favor of the content he wants to teach. I personally enjoyed the textbook and it's much more in-depth than Elzinga's lectures. If you go to lecture and keep up with reading you will probably get an A or A-. The exams are straightforward if you do the work, and the exam averages are pretty low (since most people don't do the work) so if you keep on top of the class the curve at the end will definitely benefit you. I don't know about other professors but I would recommend taking the class with Elzinga if you are interested in econ, but not if you are looking for an easy A gen ed.",1,0,4.00,5,3,4,2,2
Fall 2018,12/09/18,The only work for this class was the textbook reading. I honestly didn't enjoy the textbook very much. I found some of Elzinga's lectures to put me to sleep but he is an ECON legend (even my mom took his class) and I couldn't ever imagine myself taking it with another professor.,1,1,4.67,5,4,5,3,2
Fall 2018,12/06/18,"I really liked Mr. Elzinga, but like some other posts say, he get very off topic in his lectures so you really need to read the textbook. The textbook is very helpful even if you just scan it. I would recommend asking people about which TA they have, because I ended up with a horrible TA. DO NOT get Divya Pandey as your TA. She is very unorganized and unsympathetic. She always told me, when I asked a question, that she was not going to answer it because it was intuitive and common sense. She also had a language barrier and our quizzes were so confusing.",0,0,3.33,3,4,3,3,6
Fall 2018,12/04/18,"This is an intro Econ class that almost everyone has to take here at UVA. I highly recommend taking it with someone that is not Elzinga. His lectures are boring and dry with little content and as the semester progressed, I found that reading the textbook material in lieu of attending class was far more useful, and it only took about half the time. The grading is also completely subjective for the tests are are very poorly graded. They follow a strict answer key despite the fact that both midterms are exclusively short answer questions.",6,0,1.33,1,2,1,4,2
Fall 2018,12/04/18,"I'm not sure if this class is dumb hard or if I'm just plain dumb. I went to every lecture and read the book vigorously and still performed poorly on the finals. Getting a good TA is KEY! Some of my friends in other discussions said their ta's would give them 2 or 3 easy quizzes that they could take home, provide them with lots of practice questions, and do a really good job of summarizing the lecture. I had 5 pretty hard quizzes and you had to be super talkative during discussion to get your participation points. Overall, important class, definitely recommend taking it to have a general knowledge of econ, but I would not count on it being a GPA booster.",2,0,4.33,5,4,4,5,4
Fall 2018,12/02/18,Elzinga's lectures are extremely boring and very hard to get through. There is some interesting content but overall a boring course.,1,1,2.33,2,2,3,3,1
Fall 2018,11/30/18,"Elzinga is super cool but sometimes a tad boring. I enjoyed the class but it's not for everyone. He is very knowledgeable in the field and the lectures are interesting. There are two short answer tests with 12 questions each and one 75 question multiple choice test for the final. The tests are a little tricky but he curves the grades at the end of the semester. The clicker questions and TA discussion points count for a little bit, but not a ton. Go to lecture and make sure to get as many TA points as you can because they can be the difference between two grades. I'd also recommend reading the textbook especially if you have no prior knowledge.",1,1,4.33,5,4,4,4,4
Fall 2017,5/01/18,"Ken Elzinga is one of my favorite professors. His lectures are interesting and worth attending. The midterms are tricky but you can do pretty well as long as you study. The final was multiple choice and much harder than the midterms, so I would not rely on dutch knockout. ",2,0,4.33,5,4,4,4,4
Fall 2017,4/11/18,"Elzinga is an amazing professor, and that's honestly why I would recommend this class. His method of teaching Econ like a liberal arts class really appealed to me, and my TA was AMAZING, so it was a great experience. The class wasn't necessarily intuitive for me (that's probably why I got a B+), but it was interesting. While the huge lecture size may be intimidating, if you sit near the front, you'll be fine (and maybe meet some new friends).",1,0,3.67,5,3,3,4,3
Fall 2017,4/09/18,John Fry is a good TA if you can choose. This class is worth taking even though it's kind of hard and not necessarily an easy A because I have found what I learned to be very useful in my other classes (not even econ classes; poly sci and more) ,3,0,4.33,5,3,5,3,2
Fall 2015,1/05/18,"Elzinga's lectures are decently interesting and help marginally with the textbook material, but you'll learn mainly from the textbook. He's monotoned but has some dry humor to make his lectures manageable. Be sure to stay ahead on readings and make sure you know how to do the problems the TA provides you because they're good indicators of the test questions.",1,0,3.67,4,3,4,3,5
Fall 2017,12/16/17,"Honestly, I don't get all the hype about Professor Elzinga - he's a funny guy, but his lectures weren't as mindblowing and magical as everyone made them out to be. I didn't like his lecture style because he would take way too long to get to the point and he would never upload notes or material that he went through in his lecture. Since the lecture hall was so big, it was easy to zone out -- one of the only reasons I was able to follow along with the course was because my amazing TA (Gabriela Busche) made her own Powerpoints and uploaded practice questions compiled from other TAs. The second test was harder than the first test, but I found the final pretty easy and I only studied the day before. DON'T rely on Dutch Knockout for your grade, since the curve for the 400 point grade was much better than the curve for the 200 point grade this semester. If you can't focus during lectures, reading the textbook is definitely a must, but I don't think it's necessary to purchase the Connect access card for extra problems if you want a good grade.  On a side note, I'd recommend reading The Invisible Hand not just for the test but because it's an interesting book :) Overall, I'd recommend taking this class because Microeconomics is a basic skill, but do not expect Elzinga to be a god.",5,1,2.67,3,2,3,2,5
Fall 2017,12/15/17,"He doesn't really upload his notes anywhere and leaves a lot of material for the TAs to clear up in discussion. The TAs all vary in quality, so much of what you get out of the course depends on the TA. His lectures are funny, but he takes the long way to get to the actual point. The class is huge too, so it was hard for me to focus.",2,1,2.67,3,3,2,4,5
Fall 2017,12/14/17,"I loved Mr. Elzinga. He is the kindest, most patient professor. While I found this class challenging, getting to know him and my TA made it worth it. (Ben Thomas is a great TA.) My advice for anyone taking this class is to spend a lot of time with the Colander textbook, not just reading but taking notes and doing practice problems. I'd also recommend going to office hours, both Mr. Elzinga's and your TA's. If the TA you end up with isn't helpful, go to the head TA instead. Being able to ask questions and talk about what I missed on quizzes and tests was invaluable to me. The second test was much harder for me than the first one, but I think a lot of the points I lost were due to rushing, and not taking the time to read each question very carefully. Mr. Elzinga designs the tests so that you have more time than you need--you should take advantage of that, and work slowly. Overall, I'm so happy I took this class, even if I found it a little bit hard--I'm thinking about being an Econ major now!",0,0,4.67,5,4,5,4,3
Fall 2017,12/13/17,"Lectures are always engaging and material is logical. I really enjoyed econ with Elzinga and it is a relatively easy course as long as you put in some effort into skimming the textbook, understanding the concepts, taking good notes, and actively engaging in discussions. Ended with an A-! I have no complaints!",0,0,5.00,5,5,5,4,3
Fall 2017,12/10/17,"This class is awesome. Unlike a lot of other college classes where you're heading into the exam not really knowing what the test is going to look like, this class is more like a high school class in that you have all the information before you heading into the exam and just really need to grind to do well. Strongly recommend keeping up with all the reading as the textbook is essential to doing well and thoroughly explains concepts that aren't necessarily discussed in lecture in a very coherent way. A lot of people have complained about the online Connect resource and don't like it, but I found it to be very helpful. The practice portion of connect provides multiple choice and fill in the blank questions for every chapter and was really helpful for checking how well I knew a certain portion of the material. Elzinga IS a legend; don't let anyone else tell you otherwise. With a class this huge, some people are bound to not like it, but I really felt like I got a lot out of every lecture. His anecdotes/obvious economic skill AND the attempts he makes to appeal to other subject areas really made for an interesting class, instead of having a teacher that drilled us on basic concepts for 55 minutes twice a week––that's what your TA is for. John Fry was an awesome TA for this course and always let us know what was coming next (quizzes, homework, etc.). The scale Elzinga creates for grades is very forgiving and you'll probably end up doing a lot better than you thought you were doing because of it. I'm not an Econ major and had no prior Econ experience heading into this class and am leaving with a good understanding of basic economic principles and found it to be very engaging. ",1,1,5.00,5,5,5,3,9
Fall 2017,12/08/17,"DO NOT TAKE PANDEY AS A TA. It is the day before the exam and I just found out that every other TA responds to questions in e-mails, hands back exams (Why didn't we get our exams back!!), provides slides, notes, practice problems, and actually gives the quizzes in a timely manner instead of giving us two quizzes all semester and then two surprise ones in the last week!!! Take any other TA, seriously, I cannot emphasize this enough",5,0,2.33,2,2,3,3,0
